[
  {
    "title": "MBSR 8-Wochen-Kurs",
    "startDate": "2026-04-14",
    "endDate": "2026-06-02",
    "schedule": "Dienstags, 18:30–21:00",
    "location": "Nikolaistraße 33-37 · 04109 Leipzig",
    "locationName": "Be Light Yogastudio",
    "locationUrl": "https://belight-leipzig.de",
    "maxSeats": 14,
    "freeSeats": 4
  }
]
